date,title,description,url
2025-08-08T05:36:51.73,New Zealand Stocks Fall Amid Tariff Concerns,"The S&P/NZX 50 index slipped 0.3% to close at 12,845 on Friday, as investors expressed concern over the impact of newly imposed tariffs on the domestic economy. A 15% tariff on New Zealand exports to the US took effect on Thursday, raising risks for the country’s export-driven economy. Traders were also on edge ahead of China’s consumer and producer price data due Saturday, with forecasts pointing to a renewed drop in the CPI, underscoring persistently weak domestic demand in New Zealand’s largest trading partner. Despite Friday’s decline, the NZX 50 rose 0.9% for the week, ending a two-week losing streak, underpinned by rising expectations that the Reserve Bank of New Zealand may cut rates later this month, following a weak jobs report. On the corporate front, heavyweights Meridian Energy (-1.2%), Infratil (-1.5%), and a2 Milk (-0.8%) led the downturn. Other notable decliners included Summerset Group (-2.2%), Oceania (-2.9%), Gentrack Group (-1.8%), and Fletcher Building (-1%).",/new-zealand/stock-market
2025-08-08T02:51:07.873,New Zealand Dollar Holds at 1-Week High,"The New Zealand dollar steadied at $0.596 on Friday, hovering at its highest level in a week, supported by a softer US dollar. The greenback remained under pressure amid growing bets on a Federal Reserve rate cut in September and concerns about the impact of new tariffs on the US economy. The kiwi also found support from still strong trade data from China—New Zealand’s largest trading partner—which showed export growth beat forecasts in July, offering some relief amid a fragile tariff truce between Beijing and Washington. Domestically, however, sentiment was tempered by recent labor market data pointing to continued weakness, reinforcing expectations that the Reserve Bank of New Zealand could lower interest rates at its meeting later this month. Adding to the headwinds, a new 15% US tariff on New Zealand exports took effect on Thursday, posing fresh risks to the country’s export-reliant economy. For the week, the NZD is up 0.8%.",/new-zealand/currency
2025-08-07T23:13:33.077,New Zealand Stocks Edge Lower but Point to Weekly Gain,"The NZX 50 dropped 18 points, or 0.1%, to 12,867 in morning trade on Friday, after remaining nearly flat over the previous month, weighed down by healthcare, industrials, and communication services. Traders continued to monitor developments in US trade tariff policy amid signs of renewed trade tensions, following President Trump’s decision to impose an additional 25% tariff on Indian imports. Caution also grew ahead of the release of consumer and producer prices in China — New Zealand’s main trading partner — due on Saturday. Markets expect the CPI to return to decline amid continued weak demand in the mainland. A slew of data from China, including retail sales and industrial production, is set to be announced next week. Among early losers were South Port NZ (-3.0%), Fisher & Paykel (-1.2%), and ANZ Group (-0.8%). However, the index remains on track for a 1.2% weekly gain — its first rise in three weeks — amid hopes of interest rate cuts at the upcoming RBNZ meeting.",/new-zealand/stock-market
2025-08-07T19:50:36.17,Mexican Peso Halts Recovery After Banxico,"The Mexican peso weakened past 18.6 per USD, halting its rebound from the one-month low of 18.88 touched on August 4th, after Banxico lowered its overnight rate to 7.75%, trimming some of the carry appeal that had recently underpinned the currency. The move followed a drop in annual inflation from 4.51% in mid-June to 3.51% in July, and slightly stronger economic growth in Q2 compared to Q1, though underlying slack persists. Still, the central bank struck a cautious tone, flagging global trade frictions and geopolitical risks as potential inflationary triggers through peso depreciation or as downside threats to growth. Meanwhile, Washington imposed new tariffs, 25% on steel and 10% on aluminum from Mexico, with duties on auto parts set to follow next week, posing fresh risks to export revenues and industrial output.",/mexico/currency
2025-08-07T19:28:45.243,"Banxico Lowers Interest Rate to 7.75%, as Expected","The Bank of Mexico lowered its key rate by 25 bps to 7.75% in its August meeting, as annual inflation declined from 4.51% in mid-June to 3.51% in July and the domestic economy expanded at a slightly faster pace in Q2 than in Q1, though slack persists. The release indicated that the Board deemed appropriate a continued cycle of rate cuts, taking into account the degree of monetary restriction implemented and anticipating that the ongoing disinflation process will allow further easing while preserving a restrictive stance. However, the central bank remains cautious amid elevated global uncertainty, from trade tensions to geopolitical conflicts, that could reignite inflation via peso depreciation or deepen the economic slowdown. While progress toward the 3% inflation target remains on track, with forecasts unchanged and still pointing to convergence by the third quarter of 2026, members underscored the importance of a flexible policy framework.",/mexico/interest-rate
2025-08-07T13:39:03.353,Mexico Inflation Rate Eases to 2020-Lows in July,"Mexico’s annual inflation rate slowed to 3.51% in July 2025 from 4.32% in June, broadly in line with market expectations of 3.53%. This marks the lowest year-on-year inflation rate since 2020. Price increases eased for agricultural products (0.17% vs 5.04%), energy (0.78% vs 3.56%), and services (4.44% vs 4.62%). Meanwhile, inflation accelerated for goods (4.02% vs 3.91%) and for food, beverages, and tobacco (5.13% vs 4.89%). Core inflation edged down slightly to 4.23% from 4.24% in June. On a monthly basis, consumer prices rose 0.27%, just below the 0.28% increase recorded in the previous month.",/mexico/inflation-cpi
2025-08-07T13:00:17.6,Mexico's Auto Exports Continue to Rise,"Mexico’s car exports climbed by 7.9% year-on-year to 289,598 units in July 2025, following a 14% jump in the prior month. Among the main exporters, shipments increased primarily for Volkswagen (+30.6% to 30,682), Stellantis (+24.3% to 32,479) and General Motors (+22% to 69,707). However, steep declines were recorded for BMW Group (-38.2% to 7,210), Honda (-20.9% to 20,233) and Mercedes-Benz (-17.7% to 6,082). In the first six months of 2025, exports fell by 1.4% to 1.96 million units. The United States was the main destination, accounting for 79.3% of total, followed by Canada (10.9%) and Germany (2.8%).",/mexico/auto-exports
2025-08-07T12:21:57.55,Mexico’s Car Output Up for 2nd Month,"Mexico's car production rose by 2.4% year-on-year to 309,453 units in July 2025, following a 4.9% increase in the prior month, signaling resilience in the sector despite the ongoing harmful US trade policy.  Among major automakers, the strongest increases were observed for Stellantis (+42% to 38,821), Toyota (+13.3% to 22,881), Nissan (+11.7% to 47,452) and BMW (+10.5% to 9,106). Conversely, production declined significantly for Mercedes-Benz (-34.7% to 4,625), Mazda (-28.7% to 11,210), Audi (-13.8% to 14,957), Honda (-12.3% to 17,060), KIA (-12.3% to 18,600) and Volkswagen (-9.9% to 27,219). In the first six months of 2025, total vehicle output edged up 0.7% to 2.32 million units.",/mexico/car-production
2025-08-07T06:32:11.12,Thailand Consumer Confidence at 2½-Year Low,"The University of the Thai Chamber of Commerce’s consumer confidence index fell to 51.7 in July 2025, from 52.7 in the previous month. This marked the sixth consecutive month of decline and the lowest level since January 2023, driven largely by lingering concerns over US tariffs, a sluggish domestic economy, and political instability. Although the US recently lowered its tariff on Thai imports from 36% to 19%, uncertainty remains over potential duties on transshipped goods from third countries via Thailand. Additionally, University President Thanavath Phonvichai noted that the economy is showing signs of stagnation and requires additional stimulus, projecting GDP growth of just 1.7% in 2025—down from a 2.5% expansion in 2024. Further clouding the outlook and eroding confidence was the political turmoil following Prime Minister Paetongtarn Shinawatra’s suspension, as she awaits a court ruling concerning alleged mishandling of a phone call with former Cambodian Premier Hun Sen.",/thailand/consumer-confidence
2025-08-07T06:19:36.503,Sweden Inflation Edges Up to 0.8% in July,"Sweden’s annual inflation rate edged up to 0.8% in July 2025 from 0.7% in the previous month, but missing market expectations of 0.9%, a preliminary estimate showed. This marked the highest reading since February but remained well below the Riksbank’s 2% target. On a monthly basis, consumer prices advanced 0.2%, slowing from a 0.5% rise in June. Meanwhile, the CPI with a fixed interest rate (CPIF), the Riksbank’s target measure, rose 2.8% year-on-year in July, slightly easing from a 3.0% increase in the previous month and coming in below market forecasts of a 3.0% growth.",/sweden/inflation-cpi
2025-08-07T05:59:02.31,New Zealand Stocks End Little Changed,"New Zealand's benchmark S&P/NZX 50 index ended Thursday’s session nearly flat at 12,887, as investors stayed on the sidelines amid concerns over newly imposed US tariffs. The sweeping reciprocal tariffs have now taken effect, including a higher 15% duty on New Zealand exports. Meanwhile, trade data from China — New Zealand's largest trading partner — showed exports beat forecasts in July amid a fragile tariff truce between Beijing and Washington. Domestically, labor market data released this week pointed to continued softness, reinforcing expectations that the Reserve Bank of New Zealand could cut interest rates at its meeting later this month. On the corporate front, notable gainers included Spark NZ (+1.8%) and Chorus (+1.2%), while Contact Energy (-0.8%) and Summerset (-1.3%) were among the key decliners.",/new-zealand/stock-market
2025-08-07T03:10:16.943,New Zealand 2-Year Inflation Expectations at 2.28%,"The Reserve Bank of New Zealand's (RBNZ) quarterly survey of expectations showed that business managers forecast inflation at 2.28% for the next two years in Q3 2025, edging down from 2.29% in the previous three-month period. Additionally, one-year inflation expectations eased to 2.37% from 2.41%. Meanwhile, longer-term projections showed that five-year-ahead inflation expectations increased to 2.26% from 2.18%, while ten-year expectations remained unchanged at 2.15%. As for interest rates, respondents forecast the Official Cash Rate (OCR) to be at 3.02% by the end of the September 2025 quarter, declining further to 2.86% by the end of the June 2026 quarter.",/new-zealand/inflation-expectations
2025-08-06T23:08:05.343,New Zealand Equities Rise in Early Trade,"The NZX 50 climbed 44 points, or 0.3%, to 12,924 in early trading on Thursday, after being flat in the previous session. The gain tracked a rise in US stock futures after President Trump announced a plan to impose steep new tariffs on semiconductor imports. Wednesday's data also lifted sentiment, as the unemployment rate in New Zealand rose to its highest level since Q3 of 2020, raising hopes of interest rate cuts by the RBNZ at its upcoming meeting. However, traders were awaiting the release of trade data from China—New Zealand's top trading partner—later today, amid signs of easing trade tensions between the US and China and continued weak domestic demand. Investors also kept a close eye on US trade policy after Washington imposed an additional 25% tariff on Indian goods. All sectors moved into the green, led by IT, energy, and communication services. Among the early gainers were Seek (up 1.3%), Ryman Healthcare (1.2%), Scales Corp. (0.9%), FC Investment (0.8%), and ANZ Group (0.6%).",/new-zealand/stock-market
2025-08-06T05:52:56.19,New Zealand Stocks Close Flat,"New Zealand's benchmark S&P/NZX 50 index ended flat at 12,880 on Wednesday, as investors digested the domestic jobs report. The unemployment rate edged up to a near five-year high of 5.2% in Q2, from 5.1% in Q1, but it was below the forecasted 5.3%. The data pointed to continued softness in the labor market, strengthening the case for a rate cut by the Reserve Bank of New Zealand at its meeting later this month. Markets are now pricing in a 90% chance of a 25bps cut, with the potential for further easing to a floor of 2.75% later this year or early next. Meanwhile, concerns persist over the outlook for New Zealand’s export-reliant economy, which faces a higher 15% US tariff set to take effect on August 7. Among notable large-cap movers, Infratil gained 1.3% and Spark NZ added 1%, while Auckland Intl Airport lost 1.2% and Meridian Energy slipped 0.9%.",/new-zealand/stock-market
2025-08-06T03:48:39.697,Thailand Consumer Prices Fall for 4th Month,"Consumer prices in Thailand fell by 0.70% year-on-year in July 2025, a steeper decline than the expected 0.45% drop and following a 0.25% decrease in June. This marked the fourth month of deflation, keeping inflation below the central bank’s 1%–3% target range. Despite the string of negative inflation readings, the Ministry of Commerce stated there were no signs of true deflation. A key factor behind was the decline in Dubai crude oil prices, following easing tensions in the Middle East after a ceasefire agreement. Other contributing factors included government measures to reduce living costs—such as cutting electricity rates from May to August—increased supplies of fresh vegetables, and promotional campaigns by large retailers aligned with the government’s stimulus efforts. Meanwhile, core consumer prices, rose 0.84% year-on-year, the slowest pace of growth in six months, slightly below the forecasted 0.90% and easing from a 1.06% gain in June.",/thailand/inflation-cpi
2025-08-06T02:56:07.24,NZ Dollar Rises on Weaker Greenback,"The New Zealand dollar rose to around $0.595, hitting a one-week high, as the US dollar continued to struggle amid higher prospects of interest rate cuts by the Federal Reserve. Mounting concerns about the US economy—particularly signs of a cooling labor market—have bolstered bets on a September rate cut. However, the kiwi's gains may be limited by a weaker-than-expected local jobs report. While New Zealand’s unemployment rate ticked up to a near five-year high of 5.2% in Q2, it was still a little below forecasts of 5.3%. This reinforced expectations that the Reserve Bank of New Zealand could cut rates at its meeting later this month. Markets now price in a 90% chance of a 25bps cut, with the potential for further easing to a floor of 2.75% later this year or early next. Adding to concerns, the Trump administration imposed a 15% tariff on New Zealand exports, effective August 7, potentially placing further strain on the country's export-driven economy.",/new-zealand/currency
2025-08-06T01:50:44.517,"Thailand Rolls Out THB 18.5 Billion Stimulus, Pays Border Conflict Victims","Thailand will spend THB 18.5 billion on stimulus measures to boost economic competitiveness, as it prepares for the impact of new U.S. tariffs, Deputy Finance Minister Julapun Amornvivat said Tuesday. The cabinet also authorized the government to draft a joint statement on trade with the U.S., though talks are still ongoing with no set signing date. The U.S. recently imposed a 19% tariff on Thai imports, lower than the earlier proposed 36% and more in line with regional peers. Julapun noted that an additional THB 25 billion remains available for tariff-related and broader relief efforts. Separately, the government approved compensation for victims of last month’s border conflict with Cambodia: THB 10 million for families of fallen officials, up to THB 1 million for injured personnel, THB 8 million for families of deceased civilians, and up to THB 800,000 for civilians wounded in the clashes.",/thailand/news
2025-08-05T23:08:30.47,New Zealand Shares Drop After Jobs Data Release,"Equities in New Zealand fell 24 points, or 0.2%, to 12,853 in morning trade on Wednesday, halting gains from the previous session after fresh data showed the unemployment rate rose to 5.2% in Q2 — the highest since Q3 2020 — though slightly below market expectations of 5.3%. The data raised concerns about New Zealand’s economic outlook, amid additional headwinds from newly announced 15% US tariffs. The NZX 50 tracked a downbeat session on Wall Street on Tuesday amid rising trade tensions, disappointing economic data, and mixed corporate earnings. Traders also continued to monitor the US trade tariff policy after President Donald Trump threatened to impose tariffs of up to 250% on pharmaceutical imports. Utilities, healthcare, consumer staples, and financials mainly dragged the index, with notable losses from Freightways (-1.2%), Westpac Banking Corporation (-1.2%), Fisher & Paykel (-0.9%), Briscoe Group (-0.7%), Ebos Group (-0.4%), and ANZ Group (-0.3%).",/new-zealand/stock-market
2025-08-05T22:51:47.413,New Zealand Jobless Rate Rises to 5.2% in Q2,"New Zealand's unemployment rate edged up to 5.2% in the June quarter of 2025, slightly above the previous quarter's 5.1% and in line with market expectations. The number of unemployed individuals rose to 158,000, up from 156,000 in March and marking an annual increase of 16,000 people, or 11.1%. Meanwhile, the seasonally adjusted labour force participation rate dipped to 70.5% from 70.7% in the previous quarter, indicating a slight contraction in workforce engagement. The underutilisation rate—a broader measure of spare labour capacity—also climbed to 12.8%, up from 12.4% in March and 11.9% a year earlier. These figures suggest growing slack in the labor market, adding pressure on policymakers as economic momentum continues to soften.",/new-zealand/unemployment-rate
2025-08-05T13:10:39.76,Mexico Gross Fixed Investment Drops for 9th Month,"Gross fixed investment in Mexico declined 7.1% year-on-year in May 2025, marking the ninth consecutive contraction, though improving from the 12.5% drop in April. The fall was mainly driven by a 10.3% decline in machinery and equipment investment, largely due to a 28.6% plunge in imported transport equipment. Overall investment in imported goods dropped 13.7%, while investment in national goods fell 4.8%. Construction activity also declined, with non-residential building down 17.5%, offsetting a 9.6% rise in residential construction. Public investment plunged 25.8%, and private investment decreased 4.9%. On a seasonally adjusted basis, gross fixed investment rose 0.9%, rebounding from a 1.6% drop in April.",/mexico/private-investment
2025-08-05T06:00:58.8,New Zealand Shares Rebound,"New Zealand's benchmark S&P/NZX 50 index rose 1.5% to close at 12,877 on Tuesday, rebounding from a four-week low, as investor attention turned to key Q2 labor data. The unemployment rate is expected to rise to 5.3%, the highest since Q4 2016, reinforcing expectations for a rate cut by the central bank at its upcoming meeting this month. Traders also continued to brace for the US to raise tariffs on New Zealand goods from 10% to 15% starting August 7, heightening concerns about economic repercussions and putting pressure on key export sectors. Meanwhile, data showed a surprisingly strong performance in China’s services sector in July, easing concerns over Kiwi exports given the close trade relationship. Across the bourse, financial and healthcare shares led gains, with top performers including Westpac Banking (+1.1%), ANZ Group Holdings (+1.5%), and Fisher & Paykel (+2.4%).",/new-zealand/stock-market
2025-08-05T02:22:50.947,New Zealand Dollar Declines,"The New Zealand dollar slipped to around $0.590 on Tuesday, snapping a two-day gain and moving back toward a more than two-month low, as investor focus shifted to key Q2 labor data due later this week. The market expects the unemployment rate to rise to 5.3%, the highest since Q4 2016, strengthening the case for a rate cut by the central bank at its upcoming meeting this month. Meanwhile, starting August 7, the US will raise tariffs on New Zealand goods from 10% to 15%, fueling concerns about the potential economic impact and putting pressure on key export sectors. However, economists believe the overall effect will be manageable, supported by strong commodity prices. Elsewhere, private data showed an unexpectedly strong performance in China’s services sector in July, helping ease concerns over Kiwi exports due to close trade ties. A softer US dollar also provided some support, following a weaker-than-expected US jobs report that boosted expectations for earlier rate cuts.",/new-zealand/currency
2025-08-04T23:00:59.673,New Zealand Stocks Snap 4-Day Declines,"Equities in New Zealand rose 91 points, or 0.7%, to 12,775 in morning trade on Tuesday, halting losses from the previous four sessions. The NZX 50 tracked an upbeat session on Wall Street overnight, as a weaker-than-expected jobs report raised bets on interest rate cuts happening sooner. Traders anticipated the release of New Zealand's unemployment data for Q2 later this week, with the market expecting it to rise to 5.3% — the highest since Q4 of 2016 — raising hopes that the central bank will cut interest rates at its next meeting this month. However, traders continued to monitor the development of US trade tariff policy and were anticipating the release of services PMI data from China, New Zealand's top trading partner, later today. Almost all sectors traded in the green, including financials, consumer discretionary, utilities, and healthcare, with notable gains from Infratil (3.7%), ANZ Group (1.9%), Mainfreight (1.5%), Skellerup (1.3%), and Fisher & Paykel (0.9%).",/new-zealand/stock-market
2025-08-04T12:49:04.633,Mexico Consumer Confidence Rises in June,"Consumer confidence in Mexico rose to 45.9 in June 2025 from an upwardly revised 45.5 in May. The improvement was driven by increased optimism about current conditions, including the household’s ability to purchase durable goods (up 2.5 points to 32), the current state of the national economy (up 0.1 to 40.8), and the household’s current financial situation (up 0.1 to 51.8). However, sentiment toward future conditions weakened, with expectations for the household’s economic situation falling 0.2 points to 57.4, and expectations for the national economy dropping 0.3 points to 47.5.",/mexico/consumer-confidence
2025-08-04T05:53:54.85,New Zealand Stocks Close at Nearly 4-Week Low,"New Zealand's benchmark S&P/NZX 50 index fell 0.4% to 12,684 on Monday, marking its fourth straight decline and closing at its lowest level in nearly four weeks, as investors focused on the impact of fresh US tariffs. The US is set to raise tariffs on New Zealand products from 10% to 15% effective August 7, fueling concerns over economic fallout and putting New Zealand at a disadvantage in key exports. Still, economists believe the effect will be manageable given strong commodity prices. New Zealand officials are reportedly heading to Washington following last week’s announcement. Meanwhile, adding to market caution was New Zealand’s Q2 unemployment data and upcoming trade and CPI figures from top trading partner China due later this week. Across the board, losses were led by Gentrack Group (-3.2%), Sanford (-2.9%), and Fletcher Building (-2.7%). Shares in consumer and distribution services also declined, with Vulcan Steel down 2% and SkyCity off 1%.",/new-zealand/stock-market
2025-08-04T02:28:12.303,New Zealand Dollar Extends Rebound,"The New Zealand dollar rose to around $0.592 on Monday, extending its rebound from the previous session after hitting a more than two-month low. The gains came amid a relatively soft US dollar and as traders assessed the impact of new US tariffs. The greenback weakened last week following a disappointing US jobs report and President Donald Trump's dismissal of a top labor official, prompting markets to price in two potential Federal Reserve rate cuts, with the first expected in September. Meanwhile, the US is set to raise tariffs on New Zealand products to 15% from 10%, effective August 7, heightening concerns about the economic impact and putting New Zealand at a disadvantage in key exports. However, economists believe the effect will be manageable given currently strong commodity prices. Investors now await key domestic labor data due later this week, with the unemployment rate expected to climb to an over eight-year high of 5.3%.",/new-zealand/currency
2025-08-03T23:06:04.507,New Zealand Stocks Kick off Week Lower,"New Zealand’s stocks fell 16 points, or 0.1%, to 12,714 in morning trade on Monday, down for the fourth straight session, tracking a sharp selloff on Wall Street on Friday, driven by weak July jobs data and a new tariff policy announced by US President Trump. The NZX 50 hit its lowest level since mid-July, weighed down primarily by tech, communication services, and financial stocks. Traders remained focused on the development of US tariffs, as New Zealand’s top diplomat, Vangelis Vitalis, flew to Washington following last week’s announcement that the US would impose a 15% tariff—an increase from the 10% initially threatened in April. Trade Minister Todd McClay is also expected to visit Washington in the coming days, according to local media reports. Market caution was further heightened ahead of the release of New Zealand’s Q2 jobless rate and upcoming trade and CPI data from China later this week. Among early losers were Gentrack Group (-1.5%), Infratil (-0.7%), and ANZ Group (-0.6%).",/new-zealand/stock-market
