date,title,description,url
2025-08-01T15:50:35.79,Mexican Peso Struggles to Recover,"The Mexican peso slid past 18.80 per USD to one-month lows, despite a softer dollar chiefly reflecting domestic headwinds and tariff anxieties overwhelming the Mexican currency. July’s S&P Global Manufacturing PMI remained in contraction at 49.1 for the thirteenth consecutive month, while business confidence sat below breakeven at 49.4, signaling subdued export demand and muted capital expenditure. At the same time, the looming threat of 50% steel and aluminum duties and 25% levies on autos, even after a 90-day reprieve, has stoked risk aversion toward peso assets, as market participants fear a hit to trade flows and corporate earnings.",/mexico/currency
2025-08-01T15:15:07.537,Mexico Factory Activity Contracts for 13th Month,"Mexico’s S&P Global Manufacturing PMI rose to 49.1 in July 2025, compared to 46.3 in June, indicating a thirteenth successive deterioration but the softest contraction since January. The rise reflects a marginal easing in new orders, which firms attributed to lingering US tariffs and heightened competition from Chinese imports. Factory output also fell, albeit at the mildest pace since February, while purchasing activity declined for the seventh consecutive month as companies sought to adjust inventories amid persistent cost pressures. Employment decreased for the fifteenth month running, though at the slowest rate in the current period of job shedding. Input prices continued to climb at the steepest rate in three months, yet most producers absorbed these higher costs, with selling prices rising only marginally. Despite the ongoing downturn, sentiment improved to an eight-month high, though growth expectations remain subdued within the context of the historical series.",/mexico/manufacturing-pmi
2025-08-01T13:17:55.43,New Zealand Dollar Rebounds from 2-Month Low,"The New Zealand dollar rose above $0.59 on Friday from the two-month low of $0.586 earlier in the session, halting six session of losses as a plunge for the greenback offset fresh US tariffs on New Zealand. Payrolls in the US were revised sharply lower and the unemployment rate rose despite a lower labor force. Meanwhile, US trade levies on New Zealand were raised to 15% from the 10% baseline announced in April. The new tariff rate, set to take effect next week, has fueled concerns about the outlook for New Zealand’s export-driven economy. Additionally, consumer confidence in New Zealand dropped in July, amid expectations of rising inflation. The kiwi still fell around 2% in this week.",/new-zealand/currency
2025-08-01T12:15:56.86,Mexican Manufacturers Remain Pessimistic,"Mexico's manufacturing business confidence edged up to 49.4 in July 2025, from a downwardly revised 49.2 in June. Yet, it marked the fifth straight month the index has remained below the 50-point threshold, signaling continued pessimism in the sector. The willingness to invest showed a slight improvement, rising to 38.2 from 37.4, while the current assessment of the country’s overall situation also edged up to 48.6 from 48.5. In contrast, the current assessment of individual companies slipped to 51.1 from 51.3. Meanwhile, expectations for the company’s future outlook declined marginally to 56.6 from 56.7, and confidence in the broader domestic economy also softened slightly to 52.5 from 52.6.",/mexico/business-confidence
2025-08-01T08:11:32.273,Thailand Business Confidence at 10-Month Low,"Thailand's business confidence indicator fell to 45.8 in July 2025 from 48.6 in the previous month. The latest figure marked the lowest level since September 2024, signaling mounting concerns across several key economic areas. The performance sub-index dropped significantly to 44.3 from 49.3 in June, while production declined to 45.1 from 51.0, amid pronounced contractions in output within the plastics, food processing, and electrical appliance industries. Moreover, sentiment continued to deteriorate in employment (48.6 vs 49.6), overall order books (45.6 vs 48.0), and export conditions (44.3 vs 48.4), while investment sentiment weakened (50.6 vs 52.0). On the pricing front, output costs edged up to 44.6 from 44.4, indicating a slight cost pressures across industries. Looking ahead, the three-month forward-looking business sentiment index fell to 47.9 in July—its lowest level since August 2021—from 49.5 in the previous month.",/thailand/business-confidence
2025-08-01T07:11:56.517,Sweden Manufacturing PMI Highest in Over 3 Years,"Sweden’s Swedbank Manufacturing PMI increased to 54.2 in July 2025 from a downwardly revised 51.8 in the previous month. This marked the highest reading since May 2022 and was broadly in line with the index's historical average of 54.3. The largest positive contribution came from the sub-index for incoming orders (56.2 vs 48.8 in June), followed by suppliers' delivery times (53.1 vs 50.7) and inventory purchases (46.4 vs 47.5). However, the sub-indices for production (54.8 vs 55.6) and employment (51.7 vs 52.1) contributed negatively. Meanwhile, manufacturing companies' production plans remained optimistic, with the index rising to 63.6 from 62.8. The index for suppliers' raw and input prices edged down to 50.3 from 50.4, indicating that price pressures in the sector remain subdued. Jörgen Kennemar, responsible for the PMI analysis, warned that uncertainty surrounding global trade policy remains and lies like a wet blanket over Swedish industry with a risk of potential setbacks ahead.",/sweden/manufacturing-pmi
2025-08-01T05:54:57.123,NZX 50 Extends Losses on New US Tariffs,"New Zealand's benchmark S&P/NZX 50 index dropped 0.7% to close at 12,729 on Friday, extending losses for the third consecutive day to mark its lowest level since July 23, after President Donald Trump announced steeper tariffs against dozens of countries. New Zealand was specifically hit with a 15% base tariff rate, up from the 10% announced in April, raising concerns about the outlook for the country’s export-driven economy. In domestic news, consumer confidence in New Zealand dropped in July, amid expectations of rising inflation. Meanwhile, investors now await the US non-farm payrolls data later in the day for more clues on the Federal Reserve's rate path. Health technology stocks led the decline, with heavyweights Fisher & Paykel and Ebos Group shedding 2.2% and 2.25%, respectively. Construction materials maker Fletcher Building also lost 1.3%. Real estate stocks were also among the underperformers. For the week, the NZX 50 fell 1%, recording its second straight weekly loss.",/new-zealand/stock-market
2025-08-01T02:43:48.2,New Zealand Dollar Falls to 2-1/2 Month Low,"The New Zealand dollar fell to $0.587 on Friday, marking its seventh consecutive session of losses and hitting its lowest level since mid-May, after US tariffs on the country were raised to 15% from the 10% baseline announced in April. The new tariff rate, set to take effect next week, has fueled concerns about the outlook for New Zealand’s export-driven economy. Adding further downward pressure is a broadly stronger US dollar, buoyed by a hawkish Federal Reserve and continued signs of resilience in the US economy. Investors are now awaiting the release of US non-farm payrolls data later in the day for more clues on the Fed's rate path. In domestic news, consumer confidence in New Zealand dropped in July, amid expectations of rising inflation. The kiwi is down more than 2% so far this week.",/new-zealand/currency
2025-08-01T00:45:30.843,Thailand Manufacturing Sees Fastest Growth in 11 Months,"The S&P Global Thailand Manufacturing PMI rose to 51.9 in July 2025 from 51.7 in June. This marked the third consecutive month of expansion and the sharpest improvement in operating conditions in nearly a year. This reflected growing momentum in production activity and business conditions. New orders grew at the fastest pace so far this year, supported by rising client interest and stronger export demand. In response, manufacturers ramped up production and purchasing activity, leading to higher input inventories. Employment levels also picked up after stalling in June, helping reduce backlogs. Meanwhile, output price inflation eased close to neutral as input costs fell slightly, thanks to supplier discounts and bulk buying. However, stocks of finished goods dipped again amid outbound shipments. Business confidence improved to an 11-month high, with firms optimistic about future output due to marketing efforts and expansion plans.",/thailand/manufacturing-pmi
2025-07-31T23:06:20.213,New Zealand Stocks Inch Lower to Open August,"Stocks in New Zealand slipped 12 points, or 0.1%, to 12,811 on the first trading day of August, falling for the third consecutive session. Losses were led by commercial services, financials, and non-energy minerals. Sentiment was weighed down by a drop in U.S. futures after President Trump signed an executive order late Wednesday imposing new tariff rates on select trading partners, which took effect on August 1. The NZX 50 is on track for a second straight weekly loss, down about 0.3% so far, amid reports of weakening consumer sentiment driven by concerns over potential GDP and employment contractions in Q2. In China, New Zealand’s key trading partner, services activity in July grew the least in eight months, while factory output shrank for a fourth straight month. Still, losses were capped by hopes that the RBNZ may ease policy further amid subdued inflation. Notable laggards included Summerset Group (-1.4%), Colonial Motor (-1.3%), and Fletcher Building (-1.0%).",/new-zealand/stock-market
2025-07-31T22:52:24.13,NZ  Building Permits Fall in June,"The number of building consents issued for new dwellings in New Zealand fell by 6.4% month-on-month in June 2025 to a seasonally adjusted 2,627 units. This total included 1,302 stand-alone houses, 1,169 townhouses, flats, and units, 116 apartments, and 40 retirement village units. Despite the monthly decline, the total number of new dwellings consented in the year ended June 2025 rose 1.0% to 33,979 compared to the previous year. The number of new dwellings consented per 1,000 residents remained steady at 6.4. Meanwhile, the annual value of non-residential building work consented fell 0.9% to $9.0 billion, indicating softness in the commercial construction sector.",/new-zealand/building-permits-mom
2025-07-31T22:11:56.623,NZ Consumer Confidence Drops as Recovery Stalls in July,"The ANZ-Roy Morgan Consumer Confidence index fell to 94.7 in July from 98.8 in June, continuing its recent volatile trend and signaling persistent economic weakness. The decline points to a sluggish recovery from last year’s recession, with weakening activity indicators and possible contractions in both GDP and employment in the June quarter. Consumer spending remains soft, as the share of households saying it’s a good time to buy a major item fell to -8, while the housing market continues to stagnate. Inflation expectations rose to 5.1%—the highest since April 2023—driven by rising costs in essentials such as food, insurance, and utilities. Perceptions of personal finances and economic conditions deteriorated further, weighing on future sentiment. However, easing mortgage rates and strong farm incomes may offer some support in the coming months, potentially paving the way for RBNZ rate cuts to aid the recovery.",/new-zealand/anz-roy-morgan-consumer-confidence-index
2025-07-31T08:13:28.833,Thailand Retail Sales Growth Slows,"Retail sales in Thailand rose by 26.1% year-on-year in May 2025, slowing from a 41.9% growth in the previous month. Sales increased at a softer pace for non-durable goods (1.7% vs 3.8% in April) and other goods (57.1% vs 89.3%). At the same time, sales declined for durable goods (-2.1% vs 0.6%) and motor vehicles and automotive fuel (-1.2% vs 0.7%). Meanwhile, sales in department stores, supermarkets and general stores rose further (21.7% vs 14%). On a monthly basis, retail activity dropped by 11.7% in May, reversing a 19.3% gain in April.",/thailand/retail-sales-annual
2025-07-31T07:54:22.383,Thailand Current Account Surplus Widens in June,"Thailand’s current account recorded a surplus of USD 2.4 billion in June 2025, widening from USD 1.7 billion in the same month of the previous year. The increase was mainly driven by a higher trade balance, which grew to USD 3.3 billion from USD 2.4 billion a year ago, with exports rising 16.1%, while imports increasing at a softer pace of 13.8%. Meanwhile, net deficit in services, primary income, and secondary income expanded to USD 0.9 billion from USD 0.8 billion in June last year.",/thailand/current-account
2025-07-31T07:41:35.82,Thailand Private Investment Recovers in June,"Private investment in Thailand rose by 0.7% month-on-month in June 2025, rebounding from a 0.6% decline in the previous month. The recovery was driven by a pickup in machinery and equipment investment, supported by higher domestic machinery sales and increased production of electrical equipment. Vehicle investment remained stable, as stronger imports of ships and increased registrations of pickup trucks offset declines in passenger car and truck registrations. Meanwhile, construction investment was broadly unchanged. Non-residential construction rose across all components, particularly in areas permitted for factory construction, while residential construction weakened, as reflected by a decline in permitted areas for single houses and townhouses.",/thailand/private-investment
2025-07-31T07:38:42.443,Thailand Personal Spending Falls in June,"Private consumption in Thailand fell by 0.3% month-on-month in June 2025, reversing a 0.2% gain in the previous month. Several spending categories declined, with services consumption down mainly due to reduced foreign tourist spending, although domestic tourism continued to grow. Spending on non-durable goods also weakened, dragged down by lower sales of fuel, consumer products, and alcoholic beverages. Durable goods consumption declined following a surge in car deliveries earlier in the year. In contrast, semi-durable goods saw modest gains, supported by higher imports of textiles and apparel. Consumer confidence continued to deteriorate amid growing concerns over US trade policy, weak demand recovery, and elevated household debt.",/thailand/personal-spending
2025-07-31T05:52:45.887,New Zealand Stocks Fall for 2nd Day,"New Zealand's benchmark S&P/NZX 50 index closed 0.25% lower at 12,824 on Thursday, marking its second consecutive session of losses. The local market mirrored weakness on Wall Street, where most US equities slipped after the Federal Reserve held interest rates steady again and gave no signal it plans to lower rates in September, despite mounting pressure from President Donald Trump. Further weighing on investor sentiment was the looming August 1 tariff deadline set by Trump, with several countries—including New Zealand—yet to clinch a deal. Moreover, weaker-than-expected PMI data from China raised fresh concerns over the economic outlook for New Zealand’s largest trading partner. On the corporate front, notable decliners included index heavyweights Auckland International Airport (-1.2%), Infratil (-3.1%), Mainfreight (-1.3%), Mercury NZ (-1.0%), and Spark NZ (-0.6%). The NZX 50 still posted a 1.75% gain in July, logging its third straight monthly rise.",/new-zealand/stock-market
2025-07-31T03:42:16.033,NZ Dollar Edges Up but Remains Vulnerable,"The New Zealand dollar edged up to around $0.591 on Thursday after sliding 1% overnight that marked its fifth consecutive session of declines. Despite the modest rebound, the kiwi remains under pressure due to broad US dollar strength, which extended gains after the Federal Reserve left interest rates unchanged, despite pressure from President Donald Trump to ease policy, and indicated that no decision had been made regarding a widely anticipated cut in September. Investors also remained cautious as Trump’s August 1 tariff deadline is around the corner and several countries—including New Zealand—have yet to strike a deal. Adding further pressure, weaker-than-expected PMI data from China stoked fresh concerns over the health of its economy. Given that China is New Zealand’s largest trading partner, any signs of Chinese economic weakness typically weigh on the kiwi. The New Zealand dollar is heading for a monthly loss of nearly 3%, on track to break a four-month streak of gains.",/new-zealand/currency
2025-07-30T23:05:32.133,New Zealand Equities Poised for Third Straight Monthly Gain,"The NZX 50 was little changed at around 12,860 on Thursday morning, after closing lower in the prior session, as strength in commercial services and consumer durables was offset by weakness in logistics and non-energy minerals. Traders digested the U.S. Fed’s decision to keep interest rates unchanged, though two governors dissented—the first double dissent since 1993. Locally, New Zealand’s business sentiment rose to a three-month high in July, on easing inflation expectations and a tight labor market. The benchmark index remains on track for a third consecutive monthly gain, up about 2% so far, amid optimism after the U.S. and China agreed to explore an extension of their 90-day tariff truce, with Treasury Secretary Scott Bessent downplaying concerns that President Trump might reject the deal. Top gainers included Winton Land (4.0%), South Port NZ (2.35%), and Freightways Group (1.7%), while Fletcher Building (-1.6%), Fisher & Paykel Healthcare (-0.7%), and Mercury NZ (-0.6%) fell.",/new-zealand/stock-market
,,,
2025-08-08 15:30:39,"Switzerland says tariff talks with US continue, gold industry concerned about bullion trade",,https://www.investing.com/news/stock-market-news/switzerland-says-tariff-talks-with-us-continue-gold-industry-concerned-about-bullion-trade-4181234
2025-08-08 15:30:04,Denmark stocks higher at close of trade; OMX Copenhagen 20 up 1.63%,,https://www.investing.com/news/stock-market-news/denmark-stocks-higher-at-close-of-trade-omx-copenhagen-20-up-163-4181233
2025-08-08 15:20:35,Sun Life shares fall as Medicaid uncertainty prompts US dental forecast revision,,https://www.investing.com/news/stock-market-news/sun-life-shares-fall-as-medicaid-uncertainty-prompts-us-dental-forecast-revision-4181226
2025-08-08 15:15:03,Morocco stocks higher at close of trade; Moroccan All Shares up 0.20%,,https://www.investing.com/news/stock-market-news/morocco-stocks-higher-at-close-of-trade-moroccan-all-shares-up-020-4181219
2025-08-08 15:04:29,"Under fire from Trump over China ties, Intel's Tan counters resignation calls",,https://www.investing.com/news/stock-market-news/under-fire-from-trump-over-china-ties-intels-tan-counters-resignation-calls-4181184
2025-08-08 15:00:04,Norway stocks higher at close of trade; Oslo OBX up 0.14%,,https://www.investing.com/news/stock-market-news/norway-stocks-higher-at-close-of-trade-oslo-obx-up-014-4181171
2025-08-08 14:58:44,"Stifel downgrades Crocs on weakening revenue visibility, trims price target",,https://www.investing.com/news/stock-market-news/stifel-downgrades-crocs-on-weakening-revenue-visibility-trims-price-target-4181167
2025-08-08 14:56:31,"UBS: Time to cut back on cyclicals, favor select defensives",,https://www.investing.com/news/stock-market-news/ubs-time-to-cut-back-on-cyclicals-favor-select-defensives-4181164
2025-08-08 14:55:02,Greece stocks higher at close of trade; Athens General Composite up 0.13%,,https://www.investing.com/news/stock-market-news/greece-stocks-higher-at-close-of-trade-athens-general-composite-up-013-4181159
2025-08-08 14:47:58,Tesla gets rideshare license in Texas for robotaxi service,,https://www.investing.com/news/stock-market-news/tesla-gets-rideshare-license-in-texas-for-robotaxi-service-4181135
